{
  "format": "king-sejong.repo-index/v0.1",
  "repo_identity": "git:aaaaaaaaaaaaaaaaaaaaaaaaaaaaaaaaaaaaaaaaaaaaaaaaaaaaaaaaaaaaaaaa",
  "contexts": [
    {
      "active_context_id": "ctx-example",
      "context_ref": "/Users/example/.codex/sejong/runs/example/run/king-sejong-context.json",
      "context_status": "active",
      "last_updated_at": "2026-08-02T08:00:00Z"
    }
  ],
  "rebuilt_at": "2026-08-02T08:00:00Z"
}
